{
  "id": "1101",
  "type": "material.editorial_transition",
  "aggregate_type": "material",
  "aggregate_id": "7b4a1f6e-3c2d-4e8f-9a1b-2c3d4e5f6a7b",
  "occurred_at": "2026-10-19T12:15:00Z",
  "idempotency_key": "material.editorial_transition:7b4a1f6e-3c2d-4e8f-9a1b-2c3d4e5f6a7b:3",
  "actor_id": "a1b2c3d4-e5f6-4a7b-8c9d-0e1f2a3b4c5d",
  "payload": { "material_id": "7b4a1f6e-3c2d-4e8f-9a1b-2c3d4e5f6a7b", "track": "editorial", "from": "reviewing", "to": "needs_changes", "priority": "important" }
}
