{
  "id": "1203",
  "type": "notification.escalated",
  "aggregate_type": "notification",
  "aggregate_id": "3a2b1c0d-9e8f-4a7b-8c6d-5e4f3a2b1c0d",
  "occurred_at": "2026-10-19T09:46:13Z",
  "idempotency_key": "notification.escalated:3a2b1c0d-9e8f-4a7b-8c6d-5e4f3a2b1c0d:1",
  "actor_id": null,
  "payload": { "notification_id": "3a2b1c0d-9e8f-4a7b-8c6d-5e4f3a2b1c0d", "material_id": "7b4a1f6e-3c2d-4e8f-9a1b-2c3d4e5f6a7b", "priority": "urgent", "escalation_level": 1, "escalated_to": "b2c3d4e5-f6a7-4b8c-9d0e-1f2a3b4c5d6e" }
}
