{
  "id": "1042",
  "type": "material.created",
  "aggregate_type": "material",
  "aggregate_id": "7b4a1f6e-3c2d-4e8f-9a1b-2c3d4e5f6a7b",
  "occurred_at": "2026-10-19T09:40:03Z",
  "idempotency_key": "material.created:7b4a1f6e-3c2d-4e8f-9a1b-2c3d4e5f6a7b",
  "actor_id": "1e2d3c4b-5a69-4788-9796-a5b4c3d2e1f0",
  "payload": { "material_id": "7b4a1f6e-3c2d-4e8f-9a1b-2c3d4e5f6a7b", "priority": "important", "office_id": "0f1e2d3c-4b5a-4697-8877-665544332211" },
  "published_at": null,
  "attempts": 0
}
