{
  "id": "1077",
  "type": "upload.verified",
  "aggregate_type": "upload",
  "aggregate_id": "5d6c7b8a-9f0e-4d1c-8b2a-3c4d5e6f7a8b",
  "occurred_at": "2026-10-19T11:02:44Z",
  "idempotency_key": "upload.verified:5d6c7b8a-9f0e-4d1c-8b2a-3c4d5e6f7a8b",
  "actor_id": null,
  "payload": { "material_id": "7b4a1f6e-3c2d-4e8f-9a1b-2c3d4e5f6a7b", "file_id": "9c8b7a6f-5e4d-4c3b-a2a1-0f9e8d7c6b5a", "kind": "original", "receipt_number": "R-202610-000017" },
  "published_at": "2026-10-19T11:02:45Z",
  "attempts": 1,
  "delivery": [
    { "channel": "in_app", "status": "delivered", "attempts": 1, "last_error": null },
    { "channel": "apns", "status": "failed", "attempts": 3, "last_error": "BadDeviceToken" }
  ]
}
